{
  "$schema": "../../schemas/profile-preset-v1.schema.json",
  "version": "1.0.0",
  "id": "business-application",
  "description": "Transactional application with governed behavior, integration, experience, design, and deployment semantics.",
  "requestedModules": ["ENTITY", "ACTOR", "WORK", "EVENT", "LIFECYCLE", "RULE", "INFORMATION", "ACTION", "SECURITY", "INTEGRATION", "EXPERIENCE", "DESIGN", "ARCHITECTURE"],
  "requiredRuntimeCapabilities": ["Identity", "Persistence", "Authorization", "Audit", "Transaction", "UserExperience"],
  "defaultEmitters": [],
  "requiredPatterns": [],
  "recommendedPatterns": [],
  "prohibitedPatterns": []
}
