{
  "$schema": "../../schemas/profile-preset-v1.schema.json",
  "version": "1.0.0",
  "id": "analytics-platform",
  "description": "Governed analytics, measures, lineage, transformation, reporting, and deployment semantics.",
  "requestedModules": ["ENTITY", "INFORMATION", "MEASURE", "TEMPORAL", "RULE", "ACTION", "LINEAGE", "ANALYTICS", "SECURITY", "ARCHITECTURE"],
  "requiredRuntimeCapabilities": ["SchemaRegistry", "Lineage", "BatchProcessing", "StreamProcessing", "MetricEvaluation", "Authorization"],
  "defaultEmitters": ["vertical-slice"],
  "requiredPatterns": [],
  "recommendedPatterns": [],
  "prohibitedPatterns": []
}
